{
  "id": "018f4a3e-6b9f-7a1a-9b1a-2b3c4d5e6f7a",
  "name": {
    "endonym": "test"
  },
  "metadata": {
    "created_at": "2026-05-24T00:00:00Z"
  },
  "phonology": {
    "prosody": {
      "type": "unstressed"
    },
    "sound_classes": {
      "C": {
        "values": ["p", "t", "k"]
      },
      "V": {
        "values": ["a", "e", "i"]
      }
    },
    "phonotactics": {
      "generators": {
        "default": {
          "patterns": ["CVC"],
          "type": "zipf",
          "config": {
            "a": 1.0,
            "b": 2.7
          }
        },
        "noun": {
          "patterns": ["(C)V[default]"],
          "type": "equiprobable"
        }
      }
    },
    "illegal_patterns": []
  },
  "sound_changes": {
    "preamble": [
      {
        "name": "lenition",
        "type": "full",
        "changes": [
          "p => b / V_V",
          "t => d / V_V",
          "k => g / V_V"
        ]
      }
    ],
    "eras": [
      {
        "era": 1,
        "rules": [
          {
            "name": "vowel-lowering",
            "changes": [
              "i => e / _$",
              "e => a / _$"
            ]
          },
          {
            "name": "apply-lenition",
            "changes": [
              "@lenition"
            ]
          },
          {
            "name": "stress-first-vowel",
            "changes": [
              "[V1] => [V1 +stress] / #C*_"
            ]
          }
        ]
      }
    ]
  }
}
